Unnamed: 0,description,points,country,province,variety,price
5633,"The alcohol is high, giving the wine a peppery burn, but it's fun and delicious and utterly unique, in its own high mountain way. Completely dry, the flavors are of blackberries cooked into a pie and black pepper, with just a hint of raisins.",90,US,California,Zinfandel,29
105206,"Ripe, briary aromas of wild berries, plums and earth veer into dark chocolate. Flavors are on the light side, and seem a little soft. An affordable everyday wine to serve at picnics. Don’t be misled by the “Home Ranch” description; this is not an estate wine.",82,US,California,Zinfandel,9
105173,"This is a great example of a lower alcohol, somewhat underripe Pinot Noir that shows solid depth and lovable freshness. Lively aromas of black-raspberry sorbet and dark strawberry show on the nose, while the palate picks up a tart cranberry character. White pepper, thyme and juniper enliven the fruity flavors.",92,US,California,Pinot Noir,45
115597,"Surprisingly dark for Tempranillo, this ripe and fruity wine has hints of barn and straw in the nose. The concentrated cherry/berry fruit flavors roll into drying tannins, with some seed tannin bitterness.",86,US,Washington,Tempranillo,30
94758,"Despite coming from declassified barrels from the winery's other programs, the quality still hits a very high mark on this blend of Cabernet Franc (33%), Cabernet Sauvignon (29%), Merlot (29%) and Petit Verdot. The aromas of cranberry, herbs, plum and mineral are generous followed by good depth to the fruit flavors and bitters on the finish. As always with this winery, it's the balance of acid and tannins that most impresses. Give a one hour decant.",92,US,Washington,Bordeaux-style Red Blend,25
83063,"This has flavors and aromas of hazelnut, dried apricot and coconut in between layers of lush white peach. Overall, this is very pretty and well balanced. Its light-handed finish is floral and tropical, without a sign of oak.",88,US,California,Viognier,20
52403,"The aromas are vibrant, with notes of flowers, jasmine, lime and peach. The palate drinks a hair off dry, with the concentration coming off as light but still providing interest.",87,US,Washington,Riesling,26
57723,"Elegance and finesse are the touchstones here, with the scaffolding to age for decades. Tight and precise, it shows pomegranate and red-berry fruit, stiff and potent tannins, and plenty of supporting acidity. Drink 2020 to 2030 and beyond.",91,US,Oregon,Pinot Noir,54
4936,"Defines a certain style of Paso Robles red wine, soft in structure, with easy, gentle tannins and ripe, pronounced fruit that's almost candied in sweetness. But in this case, the blackberry and cherry flavors are totally dry.",86,US,California,Syrah,20
136833,"It's hard to find good Washington Malbec under $20. Start here. Stone Tree (Wahluke Slope) vineyard provided much of the fruit, and there is a small (10%) amount of new oak in the mix. This captures the steely core of cassis, matches it to sharp, defining acids, and hones the accents of herb and cinnamon spice to a perfect pitch.",90,US,Washington,Malbec,20
99172,"This wine is made by Paso Robles-based Jeremy Weintraub, who also works at Adelaida Winery. Aromas recall beeswax, light banana, ripe nectarine, lemon curd and white flowers. Soft once sipped, it proves easy to drink, with flavors of chamomile tea, yellow pear, yellow apples and roasted nuts.",90,US,California,Roussanne,40
65928,"This vineyard selection brings a bit more concentration and complexity than the other Coelho Pinots. The mixed fruits offer flavors of red candy and Orange Crush, with a touch of the region's earthy tannins. Just 20% went into new oak.",89,US,Oregon,Pinot Noir,50
129008,"Soft, easy and dry, with a silky texture framing flavors of rosehip tea, cherry skins, cranberries and pepper. Drink now.",85,US,California,Pinot Noir,20
118128,"This brings a pleasing mix of apple, melon and peach fruit, with a good grip and moderate length. It's a fine all-purpose Oregon Chardonnay, widely available at a wallet-friendly price.",88,US,Oregon,Chardonnay,14
127077,"This Bordeaux-style blend, using the old-fashioned term Claret, may be a sly indication of its age, drinkability and overall balance. Scents of sandalwood, musk and black cherry greet you, with maturing flavors of ripe cherries and cigar box. Supple and seamless, with impeccable balance, it's now drinking at its best.",92,US,Washington,Bordeaux-style Red Blend,37
63494,"The wine is tart and pretty thin in citrus and peach fruit, leaving the oak to stick out. Still, it does show fine elegance and minerality.",85,US,California,Chardonnay,27
81252,"Lots of fun to sip this showy, overt, no-holds-barred Zin. Lavish use of new oak gives aromas of toasted bread, maple syrup and smoked bacon. The flavors say ripe strawberries and sweet blackberry jam, and the finish is sweet and spicy at the same time.",89,US,California,Zinfandel,12
16296,"This is a blend of several vineyards, instead of the winery's usual single-vineyard Chards. It's been tastefully assembled, and displays good Central Coast acidity framing tropical fruit and oak flavors with a stony, minerally edge.",87,US,California,Chardonnay,30
112029,"Rich in jammy cherry and chocolate flavors, and with finely ground, ripe tannins, this Merlot hails from an inland Sonoma County appellation. The wine is a little simple, but is elegant and very easy to drink.",84,US,California,Merlot,17
68558,"This pleasant Merlot is a little tough and gritty, but it's rich and candied in blackberry and cherry, roasted almond and vanilla flavors. Give it some time to breathe in the glass.",86,US,California,Merlot,21
122772,"A rustic tinge of barnyard-y earth marks this wine, otherwise plumed in plum and tobacco. Its personality leans toward herbaceousness, with a juiciness on the midpalate. The finish is dry and abbreviated.",85,US,California,Cabernet Sauvignon,25
5459,"This Virginia Cab Franc starts soft and ripe with loads of juicy black currant and berry flavors flecked with sweet, warm baking spices and cedar notes. A zesty kick of acidity on the midpalate and a flash of fresh, green herbs on the finish add elegance and balance.",88,US,Virginia,Cabernet Franc,29
51230,"Lots of dry elegance in this wine. It's also more acidic than your typical Napa Cabernet, with a tart bite. The tannins are young and forceful, and the finish is totally dry. As presently constituted, it's somewhat tough and lean. But the core of cherries and blackberries suggests some degree of ageabilty. Hold until 2015.",88,US,California,Cabernet Sauvignon,65
46224,"Char and savory spices accent blackberry and cherry aromas on this crisp, medium-bodied wine. On the palate, delicate fruit flavors are a bit overwhelmed amidst layers of oak and spice. It ends with a soft kiss of tannins.",85,US,New York,Pinot Noir,35
61729,"This proves that sparkling wine does not have to be bone-dry to be sophisticated. Although moderately sweet, it is complex in aroma, elegant in texture and balance, rich in flavor and long on the finish. An appealing fresh-bread aroma leads to rich poached-pear flavors. This will be great with an after-dinner cheese course.",93,US,California,Sparkling Blend,39
103599,"A kitchen-sink blend of varieties with Merlot (44%) and Cabernet Sauvignon (26%) taking the lead, this wine offers appealing aromas that suggest high-toned, sweet barrel spices, plum and herbs. It's loaded with cranberry, cherry and plum flavors with a rich mouthfeel that keeps the interest high.",91,US,Washington,Red Blend,18
39110,"This brooding, brawny wine made from mountain fruit is all about mushroom and compost notes—a true expression of the vineyard's surroundings. Black cherry fruit and youthful tannins provide context, with a sizzling streak of acidity.",91,US,California,Pinot Noir,50
10197,"A solid effort from this fine winery, from a vintage everyone is increasingly admitting was more difficult than it looked. It’s as middle of the road as you can get. It strikes all the right notes in terms of ripe, polished black-currant fruit, anise and smoky oak, yet never quite achieves complexity. Nonetheless there’s enough harmony and juiciness to satisfy.",87,US,California,Cabernet Sauvignon,25
118925,"This is the first wine made from Oregon grapes by this southern California winery. But one can't help but wonder if shipping fruit all the way down the coast might bang it up a bit. For whatever reason, this wine tastes fractured, metallic and chalky. There is a core of black cherry, but it seems surrounded by gun-metal flavors, which stick to the palate and abruptly shut down the finish.",85,US,Oregon,Pinot Noir,50
139827,"This is pure varietal, all from the estate vineyard, and already showing the warm, round supple strength of great Washington Merlot. Rich and sweetly ripe with spicy berries, wild red fruits and sweet chocolate.",91,US,Washington,Merlot,25
118762,"Spicy and completely dry, this fresh and fruity rosé is a pretty strawberry and salmon shade, with persistent flavors of cherry candy, lemon oil and nougat. There's a nice citrus snap to the finish.",88,US,Washington,Sangiovese,13
78039,"Nice blackberry, mocha, teriyaki beef and pepper flavors in this dry, smoothly tannic wine. It's too soft to show development in the bottle, but is pretty good for drinking now.",86,US,California,Syrah,24
35843,"The vineyard is located in the Chehalem Mountain AVA (not shown on the label) and reflects the dark, earthy characteristics of the region. Fruit is spicy, tart and tightly wound, mixing black raspberry, black cherry and a sip of Dr Pepper. That blackness continues with some licorice threading through the finish.",92,US,Oregon,Pinot Noir,55
33684,"Spritzy, lively and quite dry, this mixes citrus rind phenolics with apple and pear fruit. It's simple, fruity and searingly tart.",86,US,Washington,Riesling,19
141667,"Straightforward black berry and black cherry over dark, chocolaty tannins. Simple, astringent and a bit stripped.",86,US,Washington,Merlot,36
25116,"Whispers of smoke and petrol meld into wild heather honey notes on Heron Hill's richly concentrated semidry Riesling. While abundantly floral and fruity, penetrating acidity maintains balance and structure. Finishes dry, with a deliciously bitter grapefruit-pith note.",88,US,New York,Riesling,14
61424,"Generous in toasty oak aromas this Cab is otherwise rich in tar and black jam, its flavors muted by the overwhelming taste of wood.",82,US,California,Cabernet Sauvignon,10
30772,"An outstanding Reserve, this opens with potent aromas of spice and cacao, which lead onto a muscular, sleek and stylish palate that shows terrific depth of black fruits. The wine has exceptional structure, and it remains nuanced, with details of earth and stem.",92,US,Washington,Cabernet Sauvignon,45
113171,"This is an easy-drinking Pinot Gris, with light melon and pear fruit. It's well-balanced and lively, with modest concentration.",87,US,Oregon,Pinot Gris,20
17649,"Soft and one-dimensional, with a silky texture and modest flavors of cherries, cola, sassafras and spices.",83,US,California,Pinot Noir,18
84864,"Tangerine peel and citrus blossom are fragrant and fresh on this flirtatious off-dry Riesling. Straightforward and juicy in style, the palate is saturated with peach and apricot nectar. Zesty lime and touches of mineral add lift to the finish.",88,US,New York,Riesling,14
72251,"About one-third was fermented in neutral oak, the rest in stainless steel, yielding a rich and smooth wine loaded with fresh flavors of pear and nectarine fruits. There's a tasty pie crust toastiness also, and the lingering finish has you reaching for the next sip.",91,US,Oregon,Pinot Blanc,22
11196,"There is a lot of Central Coast scrub on the nose of this bottling, with anise and sagebrush spicing up the ripe red cherry and rounded strawberry notes. It's light in body, with loads of dried herb, red plum and tart strawberry flavors, proving easy to drink, with compelling acidity.",88,US,California,Zinfandel,38
107968,"A difficult wine to assess. It's so ripe and forward in sweet cherry jam and smoky, caramelized oak that it seems like a mere fruit bomb at first sip. But something about the structure goes well beyond simplicity. Could develop bottle complexity over the years, but it's unpredictable.",88,US,California,Pinot Noir,38
73643,"Shows enormously extracted black cherry and mocha flavors, a testament to how nicely ripe the difficult Grenache variety got in the winery's Rodney's Vineyard. Oak lurks in the background, giving smoky, buttery notes.",87,US,California,Grenache,30
78014,"Off-the-charts alcohol notwithstanding, this massive wine will surely please those who like their reds big, dense and deep. It's principally Grenache, packed with pure fruit flavors of cassis and blackberry compote. It retains sufficient acidity to keep it buoyant. Tannins are tongue scrapers, bone dry and astringent. This is best sipped solo, or perhaps with a really juicy, fat-laden steak.",91,US,Oregon,Red Blend,38
109264,"This is an off-dry, fruity style, bringing luscious pear, orange, golden apple and citrus flavors to the front. There's a hint of orange marmalade, and it has good weight and concentration, along with lovely purity of flavor, right through the finish. You'll be reaching for that next glass before you know it.",88,US,Washington,Gewürztraminer,11
91500,"From a newish, small producer that's worth keeping an eye on, this wine is earthy and slightly cloudy, balanced in nature. Wild strawberry and cranberry are pitted smoothly against firm, medium-bodied tannins and oak. The finish is crisp and juicy.",91,US,California,Pinot Noir,45
131839,"Kudos to the winery for picking at low brix and for keeping the residual sugar so low so that the wine is absolutely dry. It lets the palate really appreciate the acid-brightened flavors of exotic fruits, wildflowers, and, especially, Asian spices. The wine could be more concentrated, but it's still a good sipper.",88,US,California,Gewürztraminer,25
33968,"A highly aromatic and expressive wine, this explodes with scents of baked pineapple, ruby grapefruit, tangerine and apricot preserves. Fleshy, concentrated and focused, the palate has plenty of animated acidity. The flavor intensity is solid on the medium-to-long finish, ending with a touch of warmth.",88,US,New Mexico,Viognier,20
119507,"This blend of multiple varieties, some of them rare in California, can be described as rustic. It's dry, tannic and moderate in alcohol, with pretty cherry, red currant and pepper flavors. Needs food, especially cheese, to tame it.",86,US,California,Red Blend,45
105074,"Elegant aromas of blackcurrant and black cassis combine with German-chocolate cake and concentrated violet oil scents on the nose of this bottling. It is soft and full on the palate, where mouth-coating tannins present flavors of earthy loam, black cherry and hint of burnt caramel on the finish.",89,US,California,Petite Sirah,30
26968,"Impresses for the sheer volume of fruit, offering waves of pie filling raspberries, cherries and red currants, with notes of cocoa, bacon, sweet oak and savory spices. A good bite of Central Coast acidity fortunately brings briskness to the richness. Drink now–2012.",91,US,California,Pinot Noir,44
38975,"Enormously fruity and ripe, this Cab explodes with blackberry, blueberry, currant, and chocolate flavors that can only develop in a warm region. Yet there's enough of an acid-tannin structure to give it balance. Try pairing with steak with a gorgonzola cream sauce.",88,US,California,Cabernet Sauvignon,84
139982,"Nice now at 5–plus years in the bottle, with fully resolved tannins making the wine softly creamy in the mouth. The fruit is beginning to fall out, leaving a dry herbaceousness to the departing blackberries and cherries, which are fusing with the sweet vanillins of oak. Shows real elegance of structure, but it's all downhill from here, so drink up.",90,US,California,Cabernet Sauvignon,48
90493,"Leathery on the tongue, this lovely Merlot, with 7% Cabernet Sauvignon blended in, offers inviting notes of plum and cherry, completely juicy, around firm, strong tannins and balanced acidity. From two separate, rocky blocks on the winery property, this wine is concentrated and smooth. Enjoy through 2021–2025.",93,US,California,Merlot,60
118680,"This is a simple, sweetly fruity wine, more Shiraz than Syrah, with jammy blackberry and blueberry flavors. Napa brings ripeness, while Monterey brings acidity. Drink up.",83,US,California,Syrah,20
14389,"Cabernet Franc (54%) takes the lead on this blend, with the balance Merlot (29%) and Cabernet Sauvignon. The aromas of flower, barrel spice and herb are light, with slightly dried-out raspberry and cherry notes lurking in the background. It also has a medicinal top note. Flavors are super-smooth and palate-coating, finishing sweet.",89,US,Washington,Bordeaux-style Red Blend,25
38762,"Dry and rather scoury, with a rough mouthfeel. But it's clean and bone dry, and shows proper sparkling wine flavors of citrus, vanilla, yeast and green apple.",86,US,California,Sparkling Blend,19
9368,"This is the least successful Judd's Hill Cabernet in recent memory. The current '04 bottling is lean, with cherry tea and mint flavors. A disappointment.",84,US,California,Cabernet Sauvignon,42
26573,"Reserved aromas of vanilla, pickling spices and cherry are followed by light cranberry flavors with the concentration wanting.",86,US,Washington,Tempranillo,30
49523,"Rapidly maturing, with some brick coloring and secondary fruit flavors of prune and raisin. Drinking nicely, and quite delicious. Along with the smooth fruit you get smoke, dust, cocoa and a hint of caramelized sugar.",90,US,Washington,Merlot,30
107824,"A yellowish salmon in color, this wine shows hints of watermelon, bubble gum and cotton candy in the light and pleasantly uncomplicated nose. There is great energy on the palate, with more focus on a steely, metallic texture rather than ripe flavors, proving fresh, bright and quick on the sip.",88,US,California,Pinot Noir,23
128022,"Dry, ripe and exotic. Made from the Musqué clone, it shows melon, lime, mineral and white pepper flavors, with a touch of New Zealand-style gooseberry, brightened with crisp acidity. There are some green, feline notes that will make the wine controversial. Tasted twice.",86,US,California,Sauvignon Blanc,27
17447,"This is already quite soft, oxidized and mature. It's a pleasant take on Sangiovese, absolutely ready to drink and approachable with warm, raisiny fruit flavors. There's a soft, chocolaty landing that keeps the tannins easy also. But there's not much character and no real stuffing here.",85,US,Washington,Sangiovese,15
91019,"Talley's basic estate Pinot can be good, and it can be ordinary. The '06 is pretty tannic and direct. It's a hard, tough wine that's not particularly lush, although it's clean and properly varietal. You'll find cherry and currant flavors that veer into raisins.",86,US,California,Pinot Noir,36
128818,"Richly fruity and semisweet, this medium-bodied wine smells like cotton candy and tastes like pear syrup. Smooth in texture and mouth-filling in concentration, it finishes on lingering sweetness.",85,US,California,Chardonnay,12
96312,"There's a strong menthol, juniper and pine needle kick to the nose of this bottling, alongside intriguing green tea and tart plum-skin aromas. Eucalyptus oil leads the lively herbal kick of the palate, giving intense depth to the hearty black-plum and tobacco flavors, all framed by a fresh acidity.",92,US,California,Pinot Noir,60
33314,"Fresh pear, white peach and fig aromas, a rich texture, and generous vanilla and layered almond flavors describe this tasty wine that stays fresh and fruity through the finish. It offers a medium body and nice balance.",88,US,California,Viognier,25
64210,"Rough in texture, with a briary, scoury mouthfeel that emphasizes the fruitiness, giving it a candied sweetness. The tannins seem unbalanced. Lacks Napa Valley elegance, especially at this price.",84,US,California,Cabernet Sauvignon,48
129582,"A blend of 60% Montepulciano and 40% Sangiovese, this is a grippy, leathery wine, the fruit sourced from two different sites in the appellation. Black leather, baked and dried plum, and cherry combine on the palate with breadth and length, finishing as if dusted in cocoa.",90,US,California,Red Blend,38
20528,"Aromas of prunes and figs introduce a big, thick, chewy Cabernet with plenty of fruit power. Black raspberry, black cherry and black currant fruits swirl through layers of smoky wood. Tannins are quite astringent and drying.",89,US,Washington,Cabernet Sauvignon,50
101550,"Warm red-cherry aromas meet with light hints of sage and leather on the very shy nose of this bottling from one of the region's larger growers. The flavors are also light and rustic, with tart cranberry and hints of leather and game.",86,US,California,Pinot Noir,36
75907,"Racy and sleek, this low-alcohol Pinot has a silky transparency that makes it feel just fine in the mouth. The raspberry and cola flavors have a nice hint of smoky oak. Drink now.",88,US,California,Pinot Noir,30
50140,"Pure varietal, with alcohol around 13.5%—typical for Robert Karl reds. Smooth entry, rich fruit and excellent structure. Bright cherry flavors dominate, gliding smoothly through a pretty midpalate into the tannins. The tannins just barely hint at an herbal underpinning, but are plenty ripe.",90,US,Washington,Merlot,22
10985,"Dried strawberries, saddle leather, crushed violets and a hint of maple make for a fairly straightforward yet appealing nose on this wine. Pomegranate, raspberries and purple florals show on the palate, but the tannic structure still is a bit wound up, and will unfold into more anise and sage in years to come. Drink 2018–2024.",93,US,California,Pinot Noir,46
50028,"This reserve wine is a four grape, Bordeaux-style blend, with Cabernet Sauvignon holding the principal spot. The flavors are diffuse, lightly herbal and peppery, with little concentration or definition.",85,US,Washington,Bordeaux-style Red Blend,49
48415,"A simple, fruity wine, with cherry, cola, cocoa and spice flavors, wrapped into gentle tannins and cut with a bite of acidity. Easy to drink with meats, cheeses, tomato-sauced pasta.",85,US,California,Sangiovese,14
82975,"You'll find some good cherry, vanilla, cola and sandalwood flavors in this dry Pinot Noir. It's on the light side, but is modest in alcohol, with an elegant mouthfeel.",86,US,California,Pinot Noir,25
73288,"Ripe tropical fruit and oak dominate this overly sweet Chardonnay. It's very rich in pineapple tart, golden mango, buttered toast and crème brûlée flavors, but lacks dry balance. Tastes like there's a lot of white sugar in there.",84,US,California,Chardonnay,32
68229,"Tropical, thick and decidedly rich, this wine is both balanced and luxuriously fleshy, with highlights of peach, pineapple, Gravenstein apple and vanilla-kissed caramel. Full bodied, it'll still sing at the table.",90,US,California,Chardonnay,32
105444,A sugary Chardonnay whose main attraction is its honey flavor. That gives a dessert wine sweetness to the pineapple and lemon fruit. Ready now.,84,US,California,Chardonnay,30
106083,"Tank fermented, then aged in neutral French oak, this has a tawny cast to it and a soft, slightly woody flavor. The lemony flavor finishes with a mildly bitter fruit-skin note.",85,US,Washington,Viognier,24
13697,"Underneath the oak is a modest, crisp Pinot Noir, dry and appealing in raspberry, cherry, cola and mushroom flavors. The oak is a little heavy-handed, though, making the wine feel heavy and finish sweet.",86,US,California,Pinot Noir,20
65521,"Oaky and ripe, with powerful tropical pineapple, kumquat, mineral and floral aromas and flavors. New oak adds smoke, vanilla and char. The bottom line is of a flavorful, acidic and elegant Chard with a lingering, spicy finish.",90,US,California,Chardonnay,28
44658,"The Indelicato family's vineyard is basically the entire appellation. This hearty blend of Syrah, Grenache, Petit Verdot and Viognier shows it off well, with fruit-driven aromas of grape juice, grape seeds, olallieberries and sandalwood. The palate shows decent structure as well as blackberry fruit, dried oregano, beef jerky, peppercorn and sanguine flavors.",90,US,California,Red Blend,30
88715,"A beautiful rosé sparkling wine, one that shows loads of finesse and elegance. But the final word is its deliciousness. Really captivates with subtle raspberry, toast, vanilla and yeasty brioche flavors that finish so crisp and clean.",90,US,California,Sparkling Blend,27
53669,"Soft, round and textured, this is a minty Zinfandel with a pronounced jolt of smoke on the long finish.",85,US,California,Zinfandel,14
40550,"This is an equal split of Cabernet Sauvignon and Merlot. Medium bodied, it's peppery in cassis, cedar, cinnamon and vanilla. Big, pillowy tannins fill the palate, staying firm and sizable through the finish.",90,US,California,Cabernet Sauvignon-Merlot,95
59506,"An unusual earthy, herbal character dominates the mild fruitiness and marzipan character of this medium-bodied, slightly sweet wine.",83,US,California,White Blend,23
66468,"Delivers just what consumers want in a Viognier, namely, vibrantly exotic and powerful fruity flavor. Mangoes, papayas, anything your heart desires can be found, in a rich, dry, creamy texture. White chocolate even shows up in the long, delicious finish.",90,US,California,Viognier,22
40453,"A soft, gentle Zinfandel, a little sweet, like a raspberry and cherry mocha drink sprinkled with cocoa and cinnamon. Easy to drink with spicy meats, soft cheeses, everyday fare.",85,US,California,Zinfandel,16
