Unnamed: 0,description,points,country,province,variety,price
95881,"This elegant effort is 46% Cab Sauvignon, 36% Merlot and 18% Cab Franc; still wrapped up tight and showing tart cassis and berry fruit. There is a lot of the classic Ciel minerality underlying the fruit, with hard tannins and lightly peppery herbal details. At just 14.1% alcohol, this is a classic example of how Washington brings bright New World fruit and terroir to a style that retains the elegance of the Old World.",91,US,Washington,Red Blend,40
73390,"This is a well-made, delicately floral style of Pinot Grigio, with notes of apple blossoms, crisp tree fruits and bracing minerals that add length and texture.",90,US,Washington,Pinot Grigio,14
145394,"Always an interesting Bordeaux blend to taste, this mixture of Sauvignon Blanc, Sémillon, Malvasia Bianca and Orange Muscat is alive with citrus, orange blossom, mineral and dried herb aromas and flavors. It's very complex in the mouth, and zesty with fresh acidity. Fun to drink, but also a serious white wine.",90,US,California,Bordeaux-style Red Blend,21
115738,"Shows that typical enormous Santa Lucia fruit that's so massive that it just stuns. Offers gobs of cherry marmalade, blueberry pie filling, pomegranate and cola-root beer flavors, yet the wine somehow stays silky-elegant. Who knows where it's going, but it's delicious now.",90,US,California,Pinot Noir,43
126938,"Milk chocolate, blueberry and black currant combine around a soft core of subdued tannins and classical weavings of cedar and dried herb in this mountain-grown wine. It finishes in puckering leather.",87,US,California,Cabernet Franc,75
150683,"This wine, from a newly acquired property, is tart and young, grapy almost, with the fruit a little reduced. The wine seems to be in hiding. It falls off in the middle and finishes with tannin and little else. This may just need more time in bottle to blossom.",86,US,California,Zinfandel,26
79004,"Shows the rich fruit, acidity and silky texture of Calera's spot on Mount Harlan, with cherry, cola and sweet sandalwood flavors. It's not as complex or concentrated as the single-vineyard bottlings, but is a good approximation.",87,US,California,Pinot Noir,30
79503,"With rich melon aromas, ripe apple flavors and a soothing, almost soft texture, this wants some rich, sophisticated cooking to go with it, like sautéed fish with a classic French sauce. Subtle acidity keeps the notes of almond and apple lingering on the finish.",91,US,California,Sauvignon Blanc,14
119352,"Ultra-rich and decadent, Morgan's 08 Double L shows its signature tropical fruit, apricot and mineral flavors, accented with the smoky vanilla, buttered toast and caramel from toasted oak, and brightened with acidity. Although it's dry, it's oozing in glycerine and honey. Will not age, so drink up.",91,US,California,Chardonnay,36
36439,"Effervescent lemon, lime and grapefruit and a flinty edge define this crisp white, aged mostly in stainless steel. A ripe, unctuous finish gives the wine subtle power and voluptuousness.",88,US,California,Sauvignon Blanc,21
101779,"The vineyard is source of high-quality fruit, but also intense mountain tannins that require time to melt. Under those tannins is dramatically rich black currant and carob fruit flavor, easily big enough to sustain 100% new French oak. By 2009 this 100% Cab should begin to soften and sweeten, and it will drink beautifully for at least six more years.",93,US,California,Cabernet Sauvignon,108
16074,"This shows the sappy, sweet, ripe character of the grape; fresh and forward and bursting with flavors of just-picked berries. It's nicely dusted with chocolate and has both power and precision. The oak is layered in beautifully, enhancing but not obliterating the fruit. This is a wine to drink young.",89,US,Washington,Syrah,28
76372,"Not noticeably sweet, despite its low alcohol, this is a bowl full of crisp, green apple fruit. Clean and simple.",86,US,Oregon,Pinot Gris,20
96247,"This is a high-acid, young Pinot. Bone dry and tart, it has green mint-infused, bitter cherry flavors, and the texture is nice and silky, even elegant. Yet it lacks the sensual opulence you want in a fine Pinot, and doesn't seem likely to age.",85,US,California,Pinot Noir,27
40705,This has the richness of barrel fermented Sémillon (“French stainless steel”) without actually having any. Residual sugar just over 1%; gives it roundness and a hint of honey.,90,US,Washington,Sauvignon Blanc,19
31218,"Made from 90% Chardonnay and 10% Pinot Gris, this lovely Blanc de Blancs brims with vanilla cream, lime and pear aromas and flavors, with the yeasty, baked bread dough toastiness that mark the best sparkling wines. It's basically dry and quite high in acidity, which gives it a brisk, clean finish. Drink this fine bubbly now and for the next 6–8 years.",93,US,California,Sparkling Blend,30
116178,"There are lots of rich blackberry, cherry and currant flavors in this dry young wine. You'll also find the dried herb flavor that often characterize Alexander Valley Cabernet Sauvignon. It's a bit high in alcohol and doesn't seem to be an ager, but it's finely crafted.",90,US,California,Cabernet Sauvignon,75
89009,"With fruit from The Benches (71%) and Canoe Ridge vineyards, this wine offers aromas of toast, pineapple, peach and pear, with barrel notes (100% American) providing accents. Flavors are creamy in feel with a finish that lingers.",90,US,Washington,Chardonnay,20
137717,"Much as I love the winery's La Paulée, this tops it. There's more concentration and complex blueberry, mulberry, black cherry and plum flavors. It shows a whiff or two of mint, sage and chervil, and as with all Scott Paul wines it is impeccably balanced, non-interventionist and studiously clean.",91,US,Oregon,Pinot Noir,50
32780,"There's not a whole lot going on in this basic Pinot Noir, but it does get the idea across of silkiness, dryness, tartness and light-hearted cherry and pomegranate fruit flavors.",84,US,California,Pinot Noir,12
39946,Strong mint and menthol aromatics give way to intense fresh-cut cedar flavors. There's just too much wood for this woodchuck to chuck.,82,US,New York,Merlot,18
54173,"Vast fruity richness in this softly appealing wine, with exuberant flavors of blackberry and blueberry pie filling and milk chocolate. It's fundamentally dry, but gives the impression of sweetness, partly from oak and partly from high alcohol. Drink now.",87,US,California,Syrah,25
29750,"This is a light-bodied, simple and straightforward wine with a generous helping of toasted oak, tropical fruit and sweet vanilla notes.",84,US,California,Chardonnay,26
8066,"Crisp citrus aromas and fresh lemon and grapefruit flavors define this medium-bodied, appetizing and unapologetic wine. With lots of personality, a tingly texture and tangy finish, it's just the thing for appetizers and first courses.",91,US,California,Sauvignon Blanc,14
129233,"A 100%-organic Chardonnay, stainless steel fermented and poured into a handy-dandy, also certified-organic AstraPouch (1.5 liter). This easy-to-bring-on-a-picnic wine is clean, balanced and simply drinkable with a note of sweet grapefruit and pineapple.",86,US,California,Chardonnay,10
68943,"The nose on this bottling is a tad weak compared to other wines from the same estate, with a dense but shy black currant nose. The palate is wrapped in an extreme tannic structure, so it will need some more time to allow the pleasant black cherry, blueberry and charred-meat flavors to shine.",89,US,California,Cabernet Sauvignon,65
87466,"A bit rough and gritty in tannins, this has a stickiness that pins the fruit to the tongue. But it has elaborate fruit, with ripe and showy blackberry and cassis flavors. It might gain an extra point or two over the next six years.",89,US,California,Cabernet Sauvignon,76
79689,"Kind of Pinot Noir-like, with a silky texture, crisp acids and cherry and spice flavors. But it's rustic and simple, with a soft, gluey mouthfeel.",82,US,California,Pinot Noir,16
16202,"A rich, woody style of Pinot Blanc, the barrel toast wrapped around superripe tropical fruit flavors of banana, papaya and pineapple, with a hint of grapefruity acids. This is flat-out delicious, and could easily pass for an expensive Chardonnay.",91,US,Oregon,Pinot Blanc,22
110085,"Lincourt's grapes are so rich and well grown that they don't even need oak to make a delicious Chardonnay. The wine is dry and crisp, with appealing flavors of pineapples, tangerines and Meyer lemons. The savory creaminess seems to come from aging on the lees. What a great food wine.",89,US,California,Chardonnay,18
113645,"Tranche does an excellent job with this grape; here the palate-filling flavors are round and fleshy, with peach and pear fruit. Short-term neutral-barrel aging has further smoothed out the mouthfeel, and it finishes delightfully with just a hint of butter.",92,US,Washington,Pinot Gris,18
13319,"A more restrained style from Brian Loring, this conveys aromas of plump blackberry and plums surrounding a line of licorice. The palate is a bit thicker, with black cherry flavors lifted by bergamot-like citrus skins and chopped herbs.",90,US,California,Pinot Noir,50
84195,"This is a limited (two barrels) bottling from a Dundee Hills vineyard. Tight red currant fruit is streaked with licorice and baking chocolate. There's plenty of acid, not entirely integrated into the fruit, and a hint of caramel in the finish. Good components, though not yet a complete and seamless wine.",88,US,Oregon,Pinot Noir,45
109045,"It's hard to find a Pinot at this price that shows real sophistication, but Stephen Vincent tries hard. The wine is racy and silky, with coastal elegance. Its cherry, licorice and cola flavors have a little kiss of oak.",85,US,California,Pinot Noir,20
113517,"This bottling, from a vineyard planted in 1972, is still fresh despite being six-years-old, and represents a much lighter style of Cabernet Sauvignon that goes great with a chill. Aromas of strawberry, pepper, bay leaf, leather and black pepper lead into a tart and tangy palate, which shows a light hint of barnyard funk.",90,US,California,Cabernet Sauvignon,41
22778,"Aromatic and complex, this wine, though not quite bone dry, is tart and citrusy. The mixed fruit flavors run a spectrum from grapefruit to lemon candy to nectarine, lingering gracefully into a mineral-soaked finish.",90,US,Washington,Riesling,15
129825,"Feels unnaturally acidic, with an ultra-tart tang to the ripe cherries, cola and smoky cedar. Drink now.",84,US,California,Pinot Noir,38
90479,"Dry and softly tannic, this is a nice Cab to drink now with steaks and chops. It has herb-infused flavors of black currants and cherries, with a spicy edge.",86,US,California,Cabernet Sauvignon,20
38521,"Lively aromas, an appetizing balance and just-rich-enough fruit flavors make a good combo in this medium- to full-bodied wine. It has subtle herb and kiwi aromas, crisp apple flavors, and a texture poised between supple and tangy.",89,US,California,Viognier,14
55872,"Included is a portion (10%) of Seven Hills Merlot; it's a wine that opens up immediately with pretty fruit and floral scents, some spicy highlights, and an intriguing darker streak. There's toasted grain character that comes from the vines, not the barrels, explains winemaker Rich Funk. The wine is supple and balanced, and the bright berry and cassis flavors are nicely counterpointed with streaks of toast, caramel and chocolate.",89,US,Washington,Cabernet Sauvignon,28
75902,"Using grapes sourced from Klipsun Vineyard, this is a roughly even Sauvignon Blanc–Sémillon blend. Flavors of sweet toast, lemon verbena and melon, with a hint of mint and a splash of orange soda are all in evidence. Nicely nuanced, this does not overreach, but rather zooms in on the details of aroma and flavor that keep it interesting.",88,US,Washington,Sauvignon Blanc-Semillon,25
74719,"The aromas of this fresh, tangy wine are like parsley, garlic and lemon, and the flavors add in tart grapefruit and green tea notes. Lively, assertive and refreshing, the wine will shake up cocktail hour or a seafood course.",90,US,California,Sauvignon Blanc,24
84035,"Smooth and fruity, this all-stainless effort carries a citrusy tang into the finish. It quickly settles into a good flavor groove, with suggestions of fresh-baked bread.",88,US,Oregon,Pinot Gris,17
43226,"A blend of 54% Roussanne, 29% Marsanne and 17% Viognier from the sought-after vineyard site Alder Springs, this is an estate wine made in small quantities, gorgeous in apricot and white peach aromatics. Completed by a mouth-coating texture and crisp acidity on the finish, it offers balance and effusive minerality.",88,US,California,Rhône-style White Blend,39
63321,"A fruity-oaky and rather simple Pinot Noir. Offers plenty of upfront cherry-berry and cola fruit, with a kiss of oak, wrapped into a silky texture.",86,US,California,Pinot Noir,32
88661,"This is bursting with peach, pear and almond aromas. It's balanced and light, with 1.2% residual sugar—just the right amount to pair it with spicy Thai curry or a strongly flavored cheese course.",88,US,California,Chenin Blanc,12
120882,"Restrained mulberry aromas interweave with scents of turned soil, white pepper and clove on the earthy nose of this bottling. The sip starts with a pleasing softness but quickly grows deeper and more weighty with luxurious tannins, showing hearty red cherry and dried fennel flavors.",92,US,California,Pinot Noir,50
127882,"A heavy, softly ripe, super-extracted Cabernet. If you like sheer power, you'll get off on the massive blackberries, black currants, milk chocolate and caramelized oak.",86,US,California,Cabernet Sauvignon,45
114295,This is a dry wine that's a bit acidic and watery with thin sour-cherry candy flavors and a hit of oak.,83,US,California,Pinot Noir,20
97621,"This exceptional vineyard, more than 35-years-old, brings a wealth of subtle details to a wine that has both grace and power. There's truffle, earth, mocha, plum, spice, coffee and on and on it goes, all well integrated already. Experience would suggest that wines from this vineyard, previously made for Sineann, are exceptionally ageworthy. Drink now if you must, or cellar and drink from 2022 to 2030.",94,US,Oregon,Pinot Noir,65
125191,"Dark boysenberry, dried purple flowers, wet slate and a touch of bay leaf show on the nose of this thick and earthy bottling by the tech moguls T.J. and Valeta Rodgers. The mouthfeel is very chalky, and there is the winery's characteristic earthiness along with mocha and baking spice. But there are also brighter berry flavors, perhaps due to the sunnier slopes.",93,US,California,Pinot Noir,62
125475,"This is a dry, crisp and very elegant Sauvignon Blanc. It shows savory flavors of lemons, limes and lemongrass, girded with a fine, structural minerality. Super-clean, it's a terrific partner to grilled shrimp, bruschetta with veggies and garlic, a ham sandwich, broiled chicken with rice, you name it.",89,US,California,Sauvignon Blanc,16
146922,"A little prune, cherry and tobacco mix on the nose with some leafiness, creating a bouquet similar to Bordeaux. Black cherry and licorice are the predominant flavors, and in the end game there's a subdued coffee-tinged, reserved character to it.",89,US,California,Cabernet Sauvignon,45
118842,"Feels soft and cloyingly sweet in pineapple jam and buttered popcorn flavors, and is beginning to be tired and old. Drink up.",82,US,California,Chardonnay,34
93310,"An eccentric wine, very high in alcohol, yet there's a strange vegetal element. Otherwise, it's all about sweet blackberry jam, mushu plum sauce, white pepper and charred bacon. The green veggie note, which winemaker Matthias Pippig describes as “savage”, persists into the finish.",86,US,California,Syrah,85
132623,"Here's a sturdy, somewhat country-style red wine with some superior qualities. Although it's a bit rough in texture, it has bright, jammy flavors of black raspberries and cherries, with hints of cola and cocoa.",87,US,California,Bordeaux-style Red Blend,49
147103,"Here is a full-blown 15% bruiser. Chewy, tannic and rugged, from vines almost 40 years old. Thick and chalky, the fruit has plenty of blackberry and black cherry flavor, with a smoky streak and a hint of black tea in the slightly bitter tannins. All that stuffing needs some additional bottle time to loosen it up and soften the rough edges.",88,US,Washington,Cabernet Sauvignon,21
45141,"Fairly light in body and accessible now, this has raspberry, cherry and new oak flavors. The flavors have a spicy, oaky edge, while the tannins are notable, and the acidity provides plenty of cut. Drink now–2018.",91,US,California,Pinot Noir,58
125810,"Lava Cap has made a decent version of Barbera here, simple and blueberry-toned but the wine is a tad heavy and overly oaked and bitter on the finish.",85,US,California,Barbera,20
129580,"This is a spicy, earthy and medium-bodied selection, lengthy and concentrated in cardamom and forest pine. The fruit tends dark and brooding, with a brambly character balanced against the crispness of acidity. The spiciness persists through the finish.",90,US,California,Pinot Noir,48
117242,"A flat, dull, tightly tannic Syrah that's meaty and ripe.",82,US,California,Syrah,40
31770,"The nose is full of baking spices, cinnamon and nutmeg, as well as blackberry and black currant, with a peppery note lingering under it all. The tannins are taut, with ample acidity lifting the spicy palate. Fruit notes of black plum and black currant meld with raw tobacco leaf. The tannins linger on the finish, with plenty of dark fruit and spice.",89,US,Colorado,Cabernet Franc,28
58484,"One hundred percent new French oak is the dominant theme here. It floods the mouth with the flavors of buttered toast and vanilla. The oak influence is strong, but the underlying wine has some equally strong pineapple, mango and apple fruit. It's made in a rich California style you either love or hate.",91,US,California,Chardonnay,44
140795,"Continues the tradition of ripe, intricate Firebreaks of recent years, although not quite in the same class as the '99, '00 or '01. Still, it shares the intense cherry and cassis fruit, smooth, complex tannins and delicious veneer of oak. Drink now.",91,US,California,Sangiovese,36
102911,"A little too hot and brawny in tannins, which provides a cut across the palate that interferes with pleasure. If you can get past that, the wine is nicely dry and rich in fruit, with cherry, tobacco, spice and oak flavors.",86,US,California,Cabernet Franc,35
49481,"This single-vineyard Merlot smells sweetly of ripe black plums with just a whisper of menthol and Band Aid. Soft on the palate, there's a good amount of dark fruit, but it's a tad tired and dusty. The finish is strong with a high-toned acidity and firm tannins.",86,US,New Mexico,Merlot,25
54708,"A good Zinfandel, dry and rich in the thick tannins you'd expect off Howell Mountain. The blackberry, cassis and cedar flavors are liberally spiced with pepper. Loses a few points for a certain green herbaceousness.",86,US,California,Zinfandel,50
17782,"This bottling has consistently been one of Eberle's specialties for quality and price for many years, and it still is. With residual sugar of 5.6%, it's sweet in honey, apricot, orange, guava and Meyer lemon flavors, brightened by crisp acidity.",87,US,California,Muscat Canelli,14
90964,"A beautiful Zinfandel, softly tannic and lush, and showing how Napa Valley dominates the variety when it comes to balance and elegance. The ultra-refined tannins frame flavors of berry jam, currants, mocha, licorice and pepper. This is really a superior Zinfandel.",93,US,California,Zinfandel,27
80008,"This is a briary, low-priced Zinfandel that has notes of smoky toast and clove, with dry, mountainous tannins. It's perfumed with aromas of raspberry and violet.",86,US,California,Zinfandel,13
48104,"Shows the thick tannins and blackberry, currant, dark chocolate and smoked meat flavors that make Petite Sirah so popular. But the main drawback is excessive softness, which limits the ability of this famously ageable variety to improve in the cellar. So drink now.",86,US,California,Petite Sirah,35
118727,"Here's a fun wine that will tickle your Zin tooth and then some. It's fantastically ripe and rich in blackberry, raspberry and cherry jam, sprinkled with anisette and drizzled with cocoa dust and vanilla extract. Although it's dry, the high alcohol creates a not unpleasant sensation of glyceriney sweetness. Ready now.",88,US,California,Zinfandel,24
21788,"A distinguished Cabernet, rich in fruit and impeccably oaked. But it's young. There's a fresh, jammy taste to the blackberries, cassis and dark chocolate, and the tannins are brisk and fuzzy. Don't drink it until at least 2015, and it should develop for years afterward.",93,US,California,Cabernet Sauvignon,95
18665,"Shows the full-bodied richness and fruity concentration of all Fogarty's Pinots. Brims with red and black cherries, red currants, cola, anise, pepper, butterscotch and sandalwood flavors that are strong, and framed in strong tannins. Needs 3–6 years in the cellar to knit together and gather balance.",92,US,California,Pinot Noir,48
4240,"A rich taste of caramel wraps around toasty charred oak in this young estate wine. Dense and chewy, it shows its youth and vintage signature, a sizable presence of tannin.",88,US,California,Cabernet Sauvignon,100
116288,"Forward and accessible, this wine has broadly displayed flavors of berry and milk chocolate, along with more subtle details of cayenne and herb. The nuances sneak up on you, but make for a fascinating ride. Drink now or give it another 3–4 years.",90,US,Oregon,Pinot Noir,42
26014,"Hints of bergamot add a musky elegance to tropical notes of sweet melon and tangerine in this beautifully perfumed Riesling. There's a sugariness on the midpalate, but the finish is clean and brisk, with a shower of pink grapefruit acidity.",86,US,New York,Riesling,15
42513,"This young Tempranillo shows light, pretty strawberry and tart cranberry fruit flavors. It's sharp and herbal, young and tight; a pleasant red that does not show any particularly strong varietal character.",85,US,Oregon,Tempranillo,30
127015,"Tart and jammy, with acidic, one-dimensional flavors of pineapples, vanilla and butterscotch.",83,US,California,Chardonnay,20
116436,"There will be far less House Red in the freeze-shortened 2010 vintage. As always, a forward, compelling wine, with a swirl of black fruit, smoke, earth and cola scents. The tannins are graceful and proportionate; the finish does a gentle fade.",87,US,Washington,Red Blend,12
33002,"With a translucent ruby color, this wine shows nice Pinot Noir character. It has a light, silky texture and flavors of sour cherry and raspberry candy, Dr. Pepper cola and sandalwood.",85,US,California,Pinot Noir,13
70479,"This moderately aromatic wine offers notes of herbs, peach and soda water. It's medium sweet with lightly spritzy fruit flavors that have an herbal tinge.",84,US,Washington,Riesling,11
82155,"Made from Chardonnay, Albariño and Gewürztraminer, this is a clean white wine, brisk in acidity. It has slightly sweet flavors of tangerines, apricots, peaches and honey. A nice, versatile wine, especially with today's ethnic fare, ranging from Mexican to Vietnamese.",87,US,California,White Blend,12
36880,"A welcome addition to the Bunchgrass lineup, this white Bordeaux-style blend is one third barrel-fermented Semillon, two thirds tank-fermented Sauvignon Blanc. The ripe and textural fruit still shows a lightly yeasty character, along with highlights of honey graham cracker.",90,US,Washington,Bordeaux-style White Blend,24
57245,"Tangent is on the cutting edge of bone dry, crisply elegant and superbly fine white wines at everyday prices, and this bottling is among their best. It's wonderfully tart, with mouthwatering flavors of lemons and limes, Asian pears and minerals. A super value, and a sommelier alert.",90,US,California,Sauvignon Blanc,13
50789,"Too sweet and soft for a dry table wine, but will appeal to those who like a sugary, jammy edge. The flavors are of jellied raspberries, blackberries, chocolate and pepper.",85,US,California,Syrah,27
107430,"This blended study of 2A, 115, 667 and Pommard clones shows black pepper, red cherry, pressed purple flowers, eucalyptus and a touch of hot asphalt on the nose. The lean and light palate conveys lots of dried herbs and raspberry-cranberry juice, enlivening the tongue with sourness.",88,US,California,Pinot Noir,45
128150,"This is sweet and syrupy, with unintegrated grain and spice flavors. It seems way too young to be released, a mélange of grapy fruit, sugar and grain. The alcohol is an unbelievable 18.2%—good grief!",82,US,Washington,Zinfandel,24
100711,"Pure varietal, this was fermented in oak uprights and aged for two years in one-third new French and Hungarian oak. The oak accents complement tart flavors of raspberry and pomegranate. Give this another year or two of bottle age, and drink with pleasure from 2018 to 2025.",89,US,Oregon,Tempranillo,42
116310,"A common but drinkable Pinot Noir. It's dry and silky, with a rough mouthfeel framing cherry and herb flavors. From Testarossa.",84,US,California,Pinot Noir,20
1002,A soft mouthfeel and fresh golden delicious apple flavors make this light-bodied wine easy on the palate. It has crisp and clean flavors all the way through.,85,US,California,Pinot Grigio,18
61767,"A bit too much cat pee for me, although the crisp dryness is appealing. Beyond that, you get ripe grapefruit, lemon peel and passion fruit flavors.",84,US,California,Sauvignon Blanc,18
