Unnamed: 0,description,points,country,province,variety,price
51756,"As in 2009, the 2010 Bully includes 10% Petit Verdot, and was aged in 100% new French oak. Muscular tannins and hints of caraway speak to the substantial addition of PV, and the wine is at first chewy and closed. Give it aerating and it shows plenty of depth, with dense raspberry fruit, notes of white pepper and crushed rock, and a lively streak of lemony acid.",93,US,Washington,Cabernet Sauvignon,50
94684,"This light-bodied Rhône-style blend is mostly Grenache and Mourvèdre. It's simple and easy to drink, with flavors of raspberries, cherries and spices. Give it a bit of a chill and pair it with a hamburger.",85,US,California,Rhône-style Red Blend,22
38125,"A mix of estate-grown and sourced (from the Rogue valley) grapes, this Oregon Merlot has black cherry and chocolate at its core, but quickly thins out, with very tart acidity. It's got its own style, with stiff tannins, the leaf and stem notes subdued, and a fine balance. But it will show best with food, especially steak.",87,US,Oregon,Merlot,20
128337,"Take two somewhat obscure, often-overlooked grapes, make a 50-50 blend, and voila—magic. Peppery, fruity, grapey, loaded with berries and dotted with spice, this delicious bottle has “summer” written all over it. Pour it at any barbecue and wait for the applause.",88,US,Washington,Grenache-Carignan,22
67443,"Here is a powerful young wine with concentrated plum and cherry fruit. It's beautifully built around perfectly ripened tannins that provide solid support without being intrusive. Compact and well proportioned, it lingers with highlights of espresso grounds, dark chocolate and black tea.",94,US,Oregon,Pinot Noir,60
59244,"A little soft in acidity, a little sweet in sugary flavor, this Sangiovese has cherry, tobacco, licorice and vanilla-spice flavors that are wrapped in silky tannins.",83,US,California,Sangiovese,35
89073,"Reserve is an unregulated term, so it is unclear what this means at Silvan Ridge. This is a thin, herbal and noticeably earthy wine. There is little in the way of fruit or varietal specificity. But it's perfectly quaffable.",83,US,Oregon,Merlot,19
49998,"An elegant Viognier, this first release from a young Lake Chelan vineyard has unusual delicacy for this often-bitter grape. At a moderate 13% alcohol, it shows lemon and lime rind, pink grapefruit and just a hint of white peach flavors. It finishes dry, and despite its lightness, it has a nice grip and persistence through the finish as well as firm acidity. Could be a gem with fresh oysters.",88,US,Washington,Viognier,19
49377,"Floral aromas and flavors mingle in a sweet, slightly soapy midpalate. The fruit is nondescript; what is most noticeable are the brown, sweet spices.",85,US,Oregon,Pinot Noir,29
47452,"A glorious wine. Based on Merlot, with nearly equal parts of the two Cabernets, it's softly smooth and delicious right now. Totally bone dry, yet rich and sweet in cherries, berries, chocolate and cedar, it satisfies on every level. Expensive, yes, but a relative bargain for a great Napa wine.",94,US,California,Bordeaux-style Red Blend,50
45177,"A polished, elegant Merlot, with good structure framing deep flavors of currants, carob, violets and anise. The thick tannins suggest a good steak. Now through 2009.",90,US,California,Merlot,38
57299,"This is 100% Cabernet, with the purity that is a recurring hallmark of Rulo's wines. A deep, and deeply satisfying fruit expression, lifted with juicy acidity, brings a mélange of berries, cassis and black cherries into play. The grace notes pile on—smoke, black olive, tar, tobacco leaf, bitter chocolate. Young, bracing, and built to age.",93,US,Washington,Cabernet Sauvignon,40
21820,"Watery and sweet, like fruit juice, with orange, pineapple and buttered toast flavors.",82,US,California,Chardonnay,13
94111,"Locked down by hard tannins, this nonetheless is a beautiful Zinfandel, dry and rich in flavor. It bursts with savory wild berry, tobacco, mocha and pepper flavors, and feels elegant and refined. The tannins call for enormously rich beef, pasta, sauces and cheeses.",92,US,California,Zinfandel,35
105919,"Vibrant and youthful, this wine greets the taster with fresh, clean scents of honey, fall flowers and roses. It's medium-bodied and crisp, with a final peach note that fades a bit too quickly. Try with Thai curry. No improvement with age; drink before 2011.",83,US,New York,Gewürztraminer,18
28611,"All Cabernet from Champoux, Klipsun, Palengat and Wallula vineyards, this wine offers aromas of blackberry, incense, blueberry, pencil lead and barrel spices. On the palate, it's tightly wound with black fruit flavors and a firm backbone of tannins. The oak is primary right now. It needs extended time in the cellar to show itself fully, and will be best from 2022–2030.",95,US,Washington,Cabernet Sauvignon,140
67322,"Shows the dry, lightly elegant mouthfeel that a pure Cab Franc should have, with polished cherry and vanilla flavors. But it struggles to rise beyond country-style.",85,US,California,Cabernet Franc,22
45116,"An appealing quaffer with notes of passion fruit, papaya and citrus. It drinks a hair off dry (1.2g/L residual sugar), with moderate concentration, and goes down easy.",85,US,Washington,Sauvignon Blanc,10
64425,"Intensely herbaceous with a woody characteristic and touch of green olive, this estate-grown wine offers tight-grained tannins and a lift of acidity around deeper notes of cassis and chocolate. From a vineyard in St. Helena, it shows the relative coolness of the vintage.",90,US,California,Cabernet Franc,48
35883,"Strong, caramelized oak stars in this dry, rather one-dimensional Cabernet. Despite some black currant, anise and mocha flavors, it's like drinking toothpicks.",84,US,California,Cabernet Sauvignon,40
56009,"This is a lighter Schindler than in the past, reflecting the difficult, rain-soaked 2007 vintage. But it shows the character of the vineyard, with subtle hints of blood, rock and herb providing the foundation below the tangy, spicy and tart red fruits. Great winemakers make good wines in even the most difficult vintages; this is the proof.",89,US,Oregon,Pinot Noir,42
70873,"A bit on the weedy, sharp side, with some prickly acids. Has just enough peaches and cream flavor to satisfy Chard lovers.",83,US,California,Chardonnay,16
3176,"Distinctive in aroma and flavor profile, this medium-bodied red smells like cedar, tobacco and black pepper. A blend of Mourvèdre, Montepulciano and Barbera, it boasts an earthy personality that is appealing and unique. Fifteen percent of the proceeds from the sale of this wine are contributed to the Return To Freedom Wild Horse Sanctuary.",90,US,California,Rhône-style Red Blend,25
6457,"Sourced from a small vineyard in the The Rocks of Walla Walla, this shows classic, terroir-driven umami flavors. It's as if the fruit were soaked in seaweed, then lifted on a platform of rock. It has lovely aromatics, with a rather delicate finish that's nuanced with cherry and tar.",91,US,Washington,Syrah,60
53840,"Extraordinarily rich, offering massive blackberry and cherry jam, red currant, licorice, balsam, bitter chocolate and red pepper flavors. It's very tannic, but seems overly soft, and probably best now, so drink up.",90,US,California,Syrah,98
101059,"Simple and direct, with minty flavors of blackberries, licorice, cola, peppercorns and vanilla. On the plus side, the wine is fully dry, the tannins smooth.",84,US,California,Cabernet Sauvignon,8
72338,"A marvelous Pinot Blanc, this combines aromatic hints of almond with mixed citrus fruit and rind, zippy acidity and a great wash of minerality. It cleanses and tickles the palate, lingering sensuously through a finish of surprising depth.",92,US,Oregon,Pinot Blanc,29
122162,"Crisp acidity saves this rather sweet, oaky wine by giving it a clean mouthfeel. The flavors are of pineapple and apple juice, honey and vanilla caramel.",83,US,California,Chardonnay,17
11079,"Simple fruit and a sweet, almost candied flavor. This wine seems unbalanced. There's an odd hole in the middle, and very little weight or tannin in the finish. It's all forward, sweet fruit, more like candy than berries.",82,US,California,Zinfandel,12
141199,"Very ripe, in the manner of this spectacular vintage, showing a blast of cherry pie filling, black raspberry tart, cola and smoky oak flavors. The acidity is firm and clean. Feels juvenile, with a jamminess that a few years in the cellar should resolve.",89,US,California,Pinot Noir,54
44379,"A good bistro-style wine. With rustic flavors of berries, currants and tobacco and a clean, spicy finish, it's a wine to drink with anything calling for a dry, tannic red.",85,US,California,Red Blend,14
41628,"Excellent winemaking by Mike Januik, as with all these Novelty Hill wines, keeps the fruit, acid and tannins all in perfect proportion. The flavors mix blackberry and black cherry; and this young wine is still firm and wound tight.",89,US,Washington,Cabernet Sauvignon,28
106154,"Pretty with aromatics of rose petals, this layered, complex wine offers restrained power and demure fruit. In taste, it's a mix of black cherries and that cola-like allspice that is prevalent in many Russian River Valley sites. The mouthfeel is round and soft, with just the right tension between tannin and acidity, with a protracted finish of toasty oak.",90,US,California,Pinot Noir,58
85410,"This delicious wine is as soft, silky and supple as can be. The fruit is slathered in spicy, chocolaty oak, which lends some sharpness to the edges. Red berries and red licorice lead into finishing flavors of baking chocolate. But as tasty as it is when first opened, it fades quickly, suggesting that this is one to drink up rather than lay down.",89,US,Washington,Merlot,20
89285,"While the concentrated flavors of peaches and sweet pears are pleasant, whiffs of smoke and toasted nuts lend a savory, rather atypical character to this dry Gewürz. It's dry and brisk, with soft, lemony acidity.",84,US,New York,Gewürztraminer,13
133495,"Though fruit-driven, forward and accessible, this surprises with the chewy density of its midpalate, and the depth and texture of the finish. It begins with somewhat sweet with candy flavors of raspberries, red currants and Bing cherries. Then it opens up, adding moist earth, minerals, flint and wisps of chocolaty smoke. Firm acidity and a balanced structure complete this classically proportioned and well-defined wine. An amazing 51,000 cases were made.",89,US,Oregon,Pinot Noir,20
40407,"The later disgorging of this wine made from 67% Pinot Noir and 33% Chardonnay has given it a complexity of texture and flavor that's compelling, an older golden-apple and dried apricot sensibility that's intriguing on the nose and palate. Sizzling acidity makes for a crisp, dry wine, with lengthy finish.",93,US,California,Sparkling Blend,40
113442,"A little raw around the edges, lacking the sexy lushness you want in a fine Pinot Noir. Mostly that's a function of high acidity and a touch of minty green. Still, it's a delicious, complex wine, with oaky flavors of raspberries, cherries and Asian spices. Probably best now and for the next five years.",89,US,California,Pinot Noir,50
30434,"Light fruit flavors combine watermelon and strawberry, accented with charred, astringent tannins. A tobacco flavor threads on through the finish, with a slightly chalky mouthfeel.",87,US,Oregon,Pinot Noir,28
50408,"For this new offering from the winery, fruit comes from top vineyards Dineen, StoneTree, Klipsun, Pepper Bridge, Discovery and Kiona. It displays strong aromas of burnt coffee, woodspice and cherry. Flavors are medium bodied with blocky tannins and mouthwatering acids.",88,US,Washington,Bordeaux-style Red Blend,30
20237,"Cocoa, vanilla and baking spice aromas intertwine with cranberry, black licorice, herb and dark fruit on a wine with a very distinctive aromatic profile. The cranberry and cherry flavors are quite soft for the variety, seeming a touch dried out at times but showing a pleasing sense of balance.",90,US,Washington,Cabernet Sauvignon,38
85953,"Grassy, herbaceous tones are a tad pungent, but they add freshness to this lusciously textured, easy-drinking Gewürz. It's off-dry, with loads of fleshy yellow peach, pineapple and melon flavors, with delicate tangerine-juice acidity. Drink now.",86,US,New York,Gewürztraminer,13
85434,"This is a polished, really likeable Chard. It offers everything the variety should: a rich, creamy texture, brisk acidity, and ripe, delicious flavors of pineapples, apricots, peaches and kiwis coated with vanilla.",90,US,California,Chardonnay,27
73815,"The wine is pale in color and very light in body, neither of which is a bad thing. You want some delicacy in a Pinot Noir. The drawback is in a candied simplicity to the flavors, which are of Lifesaver cherries and raspberries.",86,US,California,Pinot Noir,50
76715,"This lush, smooth and supple Cabernet is drinkable now for its rich array of red berry fruit, briary spice, red licorice, blond tobacco and sandalwood flavors. It shows the softness of Alexander Valley Cabernet, but make no mistake, the balance enables it to age 6–8 years.",90,US,California,Cabernet Sauvignon,38
42179,"Light aromas of candle wax, kiwi and citrus lead to diluted fruit flavors. It lacks a sense of cohesion or variety.",82,US,Washington,Sauvignon Blanc,16
51477,"The wine is always a blend of the winery's best vineyards in the northern, warm section of the valley, including Allen, Rochioli Riverblock and Williams Selyem's Estate. The 2012 is dry, tannic, delicately structured and mouthwateringly tart, with cranberry, raspberry, cherry, sandalwood and dried herb flavors. Enjoy it now and through 2018.",94,US,California,Pinot Noir,69
20452,"Light and tart, this simple and fruity style has hard candy flavors of sour cherry and raspberry. A fun wine, straightforward and good for chilling.",85,US,Oregon,Pinot Noir,29
79837,"With production of more than 51,000 cases, this Cabernet will wash down lots of steaks and burgers. It's softly tannic in the mouth, with easy flavors of blackberry tea and oak.",85,US,California,Cabernet Sauvignon,23
123229,"Rhubarb, cranberry and strawberry mix on the nose in this richly inviting wine that is textured and not overwhelming in weight. Featuring electric acidity, the wine finishes boldly in blackberry and licorice.",90,US,California,Pinot Noir,42
107233,"A bit too strong in pyrazines, those notoriously green, feline aromas and tastes. Otherwise, the wine is crisp and pleasant in spearmint and citrus flavors.",83,US,California,Sauvignon Blanc,20
135379,"This is a big, strong, fruity, oaky wine that's not showing much subtlety now. It floods the mouth with blackberries, cherries, plums, spices and sweet, smoky oak, and the tannins are intricately soft and gentle. Will it develop in the bottle? No guarantees.",88,US,California,Cabernet Sauvignon,70
116870,"Not yielding much now beyond hard tannins and primary fruit flavors of black currants that verge on raisins. But then, it's Petite Sirah, a known ager, and the acid-tannin balance suggests just that. Give it until 2012, at least.",88,US,California,Petite Sirah,24
61409,"Generous in aromas of leather and chocolate-covered fig, this wine gets mushy in the middle. Thin with an earthy edge and a finish that's slightly herbal.",83,US,California,Zinfandel,24
1989,"This is serviceable but rather bland, with a dusting of cinnamon spice and simple, tart fruit.",85,US,Oregon,Chardonnay,16
12253,"An interesting wine, not without problems. Pours intensely dark, and opens with aromas ranging from blackberries to  earth and white pepper. In the mouth, straddles the ripeness line, with deliciously fruity flavors kept in check by an herbal edge. A blend of Paso Robles, Edna Valley and Santa Ynez Valley.",90,US,California,Syrah,19
42667,"About as rich and flamboyant as California Chardonnay gets, a wine that blows you away with sheer pyrotechnic wizardry. Massive in grilled pineapples, mangoes, Key lime pie, vanilla honey, crème caramel and dusty spices, accented with perfect acidity.",95,US,California,Chardonnay,30
68983,"A sleek blend of wet-cement minerality, slight dairy notes, citrus pith and a grapefruit spritz freshness makes for a very inviting nose on this wine from a new vineyard that overlooks the Santa Ynez River. A rocky, grassy element powers the palate, with lime zest and chopped Granny Smith apple-peel flavors.",91,US,California,Sauvignon Blanc,48
87756,"In this appellation blend from the single-vineyard-focused Los Gatos winery, aromas of cherry and chaparral scrub are pleasant if reluctant to emerge. The palate laces tart pomegranate and cranberry with licorice and forest-floor elements.",88,US,California,Pinot Noir,45
78061,"A streak of sharp acidity and green mint makes this wine too tart, despite some pleasant cherry, red currant, clove and cola flavors. The wine is unlikely to develop additional bottle complexity. Sourced from the Sanford & Benedict and La Rinconada vineyards.",84,US,California,Pinot Noir,34
98686,"Strong-minded with a tannic bite, this Cab has soft red fruit and a menthol quality to it that doesn't seamlessly mesh together.",82,US,California,Cabernet Sauvignon,30
102630,"Intensely floral on the nose, this is a blend of 70% Pinot Grigio grown in Carneros, 15% Traminer also grown in Carneros, and 15% Moscato giallo from Lodi, which the producer has previously employed in delightful wines of its own. Lilting and bright, it has substance behind the equal balance of fruit and spice, offering a taste of lemony ginger and pear.",90,US,California,White Blend,24
62424,"Styring releases their wines with plenty of bottle age and doesn't shy from high alcohol. The level of ripeness in this bottling is not for everyone, veering more toward Zin-like power than Pinot Noir elegance. It's lushly aromatic, with dominant pine needle and raspberry extract flavors. A dense, concentrated and pungent wine with a spicy top note.",92,US,Oregon,Pinot Noir,45
147164,"Shows all the fine qualities you want in a Merlot, such as ripe, sweet cherry and blackberry fruit, finely ground tannins, balancing acidity and a touch of oak. If only it had concentration, it would be a far better wine.",85,US,California,Merlot,22
1853,"This soft, robustly ripe wine shows a raisin-like prune character, tasting somewhat chalky on the palate.",83,US,California,Zinfandel,34
45476,"Matured in 50% new French oak, this wine offers medium concentration and appealing scents of rose petals, apples and cranberries. The tangy fruit is juicy and firm, and nicely balanced for cellaring.",90,US,Oregon,Pinot Noir,38
116574,"A beautiful young Rutherford Cabernet, showing the dusty elegance and complexity of a top estate. There's a rich herbality to the cherry, cassis and blackberry fruit, suggesting fresh green chervil, sage and thyme. Oak adds harmonious notes of vanilla, cedar and char. The tannins are thick and juvenile, but very finely ground. With 8% Cabernet Franc, this lush wine needs time. Hold until after 2008, and it should improve for another six years, conservatively.",94,US,California,Bordeaux-style Red Blend,75
29716,"This features an appealingly toasty aroma, substantial cherry and cassis fruit and a concentrated core. Elements of stem wood, black olive and clean earth filter through the finish, along with perfectly ripe tannins.",88,US,Washington,Cabernet Sauvignon,10
28200,"You'll want to stash this young Cab away for a while because it's too closed and tannic now for enjoyment. But it has a very rich, concentrated core of cassis flavor and is dry and balanced in acidity. Should negotiate the next 6–8 years easily, and maybe longer.",91,US,California,Cabernet Sauvignon,55
43115,"At 1.8% residual sugar, this estate-grown Riesling carries some definite sweetness, along with a tangy mix of lime, grapefruit and citrus peel. Leesy and textural, it puts the focus on citrus rather than floral flavors, and tails off in the finish.",88,US,Washington,Riesling,15
69535,"A little earthy, with plummy aromas accompanied by sun-dried tomato, rhubarb and hard spice notes. The flavors are along the same lines, with cherry tomato, coffee and spices. It's very dry, and finishes with a slightly dusty, tannic bite.",86,US,California,Pinot Noir,28
56926,"What's so likeable about this Cabernet is the dryness and the overall balance, which is stylish and elegant. It keeps the blackberry and black currant fruit in check with earthier tones of tobacco and olives.",90,US,California,Cabernet Sauvignon,38
117824,"This wine shows apparent barrel aging on the nose, with vanilla bean and coconut oil alongside caramelized apricot aromas. There is a very ripe papaya and guava tropicality on the palate, with a slight finish of iodine.",86,US,California,Pinot Gris,20
388,"Delicate and complex, a cool climate wine with a mixture of ripe cherry flavors and leaner ones of tobacco, tomato skin, and cranberry. Bone dry with excellent acidity, this somewhat tart wine is well made, and may be an ager.",88,US,California,Pinot Noir,25
7548,"Just lovely to drink now, it's so softly lush and decadently delicious. Beguiles the palate with jammy, pastry flavors of raspberries, cherries and sweet oak. Cabernet Sauvignon, Merlot and Cabernet Franc.",91,US,California,Bordeaux-style Red Blend,50
11882,"Lychee, roses and sweet white peaches abound in this classic Gewürztraminer. While ebulliently perfumed and slightly brawny in footprint, its bold strokes are balanced with fresh grapefruit acidity. Delicate murmurs of rose potpourri and tea leaves fringe the finish.",88,US,New York,Gewürztraminer,15
47489,"Delicious in raspberry and cherry jam flavors, with an elaborate coat of sweet, smoky, caramelized oak. Good acidity and smooth tannins make for fine structure. Could be drier and more complex, but it's a hedonistic Pinot Noir with lots of flash.",88,US,California,Pinot Noir,38
53853,"Drunken peach, green apple, gray slate and rounded butter notes hit the nose. There is a baking soda minerality on the palate, some sea salt and a tongue-tingling acidity.",84,US,California,Chardonnay,15
55219,"Part of the winery's Terroir Series, this is aromatic with bright raspberry fruit dotted with peppery herbs. It displays the spicy herbaceousness of this AVA, with excellent penetration and balance. A strong finish hits a resonant note of minerality.",92,US,Oregon,Pinot Noir,39
121116,"Made from Zinfandel, Malbec, Sangiovese and Pinot Noir, this tastes rich in cranberries, watermelons and strawberries. The acidity is refreshingly tart, but the ripe fruit flavors make it somewhat cloying on the palate.",84,US,California,Rosé,21
63929,"Drink this polished Chardonnay now with shellfish or chicken stew. It's crisp and minerally, with a hit of acidity backing up the citrus fruit, honey and vanilla oak flavors.",88,US,California,Chardonnay,26
5655,"Comprised of 75% Cabernet Franc and 25% Merlot, this is a juicy, savory and lengthy wine, with herbaceous elements of cedar, brush and peppercorn. A lush, full-bodied complement of baked plum and cherry ride out a lengthy finish.",90,US,California,Bordeaux-style Red Blend,75
38026,"This wine's thick and buttery aromas range from cashew cream and caramel to honeysuckle and Maui onion. Its powerful acidity cuts through the palate's unctuous and oily qualities, with buttercream and lemon juice flavors combining for a big personality.",90,US,California,Chardonnay,25
7535,"Brisk in acids, with lush, long hangtime lemon, kiwi, tangerine and vanilla flavors. It's all upfront in this drily delicious Chardonnay.",87,US,California,Chardonnay,26
73182,"Quite dark in the glass, this bottling has a nose that suggests boysenberry, blackberry and black cherry. The dense aromas are livened up by iron, black loam, Indian spice and black-tea notes. The same range of dark fruits power the palate, especially black plums, and the rich and tangy flavors are nuanced with black sage, bergamot and eucalyptus notes.",93,US,California,Pinot Noir,66
120098,"This is one of those old-fashioned field blends of Zinfandel, Petite Sirah, Carignane and who knows what else. It's super-fruity, with waves of blackberries, cherries and all kinds of other berries accented with milk chocolate, anise and cedar. Finishes a bit sweet and tannic. Drink now, with barbecue.",87,US,California,Red Blend,75
80609,"This unusual blend of Tempranillo, Cabernet Franc, Cabernet Sauvignon, Petit Verdot and Malbec comes from the folks who own Stagecoach Vineyard high atop Atlas Peak. A bombastically dense and concentrated wine, it's gamy, meaty and brawny all around. Black fruit, tar and tobacco combine to full-bodied effect. It would be best to wait on this one, cellaring through 2020.",92,US,California,Red Blend,100
68272,"Delicious berries and cream nose, which follows through with crisp, spicy flavors and good structure. OVOC stands for “old vines old clones” and the fruit, from head-pruned, hillside vineyards, lives up to its billing. Great all-purpose Zin.",90,US,California,Zinfandel,18
89536,"Here's a simple little wine that makes for pleasant drinking at an affordable price. It's lemony and dry and soft in acids, but it is very clean and is fine for fried chicken, fruit salad and other picnic-type fare. —S.H.",84,US,California,Sauvignon Blanc,10
71270,"This blend of 33% Cabernet Franc, 27% Merlot, 27% Petit Verdot and 13% Cabernet Sauvignon is mildly concentrated on the nose and palate, with rubbery blackberry, cranberry juice and geranium leading the way. Light bodied, with a soft grip of tannins, these flavors lead to a short finish of green peppercorn.",84,US,Virginia,Bordeaux-style Red Blend,33
